<?xml version='1.0' encoding='UTF-8'?>
<aligned-text xmlns="http://alpheios.net/namespaces/aligned-text/2.0"
 xmlns:xsi="http://www.w3.org/2001/XMLSchema-instance"
 xsi:schemaLocation="http://alpheios.net/namespaces/aligned-text/2.0 ../xsd/aligned-text-2.0.xsd"
 document_uri="http://data.perseus.org/collections/urn:cite:perseus:align.1.1"
 citeprefix="doc1: urn:cts:greekLit:tlg059.tlg002.perseus-grc1: 
             doc2: urn:cts:greekLit:tlg059.tlg002.perseus-eng1:
             doc3: urn:cts:greekLit:tlg059.tlg002.perseus-fre1:"
 version="2.0">
    <comment class="title">
        Sample Alignment of first few words of Plato's Apology to show 
        use of new schema for 3 language alignment
    </comment>
    <comment class="stdabbrev">Plat. Apol. 17a</comment>
    <link rel="http://www.w3.org/ns/prov#has_provenance" href="provenance-URI"/>
    <link rel="http://www.w3.org/ns/prov#has_anchor" href="target-URI"/>  
    <bead n="1" type="verse">
        <wds n="ws1" cite="doc1:17a" xml:lang="greek" dir="ltr">
            <w n="1-1" cite="doc1:17a@ὅτι[1]" dir="ltr">
                <text>ὅτι</text>
                <refs nrefs="1-1" wref="ws2"/>
                <refs nrefs="1-1" wref="ws3"/>
            </w>
            <w n="1-2" cite="doc1:17a@μὲν[1]">
                <text>μὲν</text>
                <refs nrefs="1-1" wref="ws2"/>
            </w>
            <w n="1-3" cite="doc1:17a@ὑμεῖς[1]">
                <text>ὑμεῖς</text>
                <refs nrefs="1-2" wref="ws2"/>
            </w>
            <w n="1-4" cite="doc2:17a@,[1]">
                <text>,</text>
            </w>
            <w n="1-5" cite="doc1:17a@ὦ[1]">
                <text>ὦ</text>
            </w>
            <w n="1-6" cite="doc1:17a@ὑμεῖς[1]">
                <text>ἄνδρες</text>
                <refs nrefs="1-4 1-5" wref="ws2"/>
            </w>
        </wds>
        <wds n="ws2" cite="doc2:17a" xml:lang="eng" dir="ltr">
            <w n="1-1" cite="doc2:17a@How[1]">
                <text>How</text>
                <refs nrefs="1-1 1-2" wref="ws1"/>
            </w>
            <w n="1-2" cite="doc2:17a@you[1]">
                <text>you</text>
                <refs nrefs="1-3" wref="ws1"/>
            </w>
            <w n="1-3" cite="doc2:17a@,[1]">
                <text>,</text>
            </w>
            <w n="1-4" cite="doc2:17a@men[1]">
                <text>men</text>
                <refs nrefs="1-6" wref="ws1"/>
            </w>
            <w n="1-5" cite="doc2:17a@of[1]">
                <text>of</text>
                <refs nrefs="1-6" wref="ws1"/>
            </w>
        </wds>
        <wds n="ws3" cite="doc3:17a" xml:lang="fre" dir="ltr">
            <w n="1-1" cite="doc3:17a@Comment[1]">
                <text>Comment</text>
                <refs nrefs="1-1 1-2" wref="ws1"/>
                <refs nrefs="1-1" wref="ws2"/>
            </w>
            <w n="1-2" cite="doc3:17a@vous[1]">
                <text>vous</text>
                <refs nrefs="1-3" wref="ws1"/>
                <refs nrefs="1-2" wref="ws2"/>
            </w>
            <w n="1-3" cite="doc3:17a@,[1]">
                <text>,</text>
            </w>
            <w n="1-4" cite="doc3:17a@des[1]">
                <text>des</text>
                <refs nrefs="1-6" wref="ws1"/>
                <refs nrefs="1-4 1-5" wref="ws2"/>
            </w>
            <w n="1-5" cite="doc3:17a@hommes[1]">
                <text>hommes</text>
                <refs nrefs="1-6" wref="ws1"/>
                <refs nrefs="1-4 1-5" wref="ws2"/>
            </w>
            <w n="1-6" cite="doc3:17a@qui[1]">
                <text>qui</text>
                <refs nrefs="1-6" wref="ws1"/>
                <refs nrefs="1-4 1-5" wref="ws2"/>
            </w>
        </wds>
    </bead>
</aligned-text>